category,blurp,imgrul,text,title,url,date
Cloud,"Rip Curl’s decision to migrate its data gathering and collection operations to the cloud earlier this year began to look like a wise move, during Australia’s pandemic lockdowns.The Australian surfwear",https://cdn.techwireasia.com/wp-content/uploads/2020/08/Rip-Curl-scaled-1-897x500.jpg,"Rip Curl’s decision to migrate its data gathering and collection operations to the cloud earlier this year began to look like a wise move, during Australia’s pandemic lockdowns.The Australian surfwear maker’s preeminent surfing competition, Rip Curl Pro, had to be postponed on short notice — like live public events globally. Internally, Rip Curl had already been consolidating data from disparate points along its operational chain — including from Rip Curl stores throughout the world — and had been working together with Microsoft to transition its data assets from on-premise platforms to Azure.Fortunately for the surfwear seller, a lot of its legacy data had already been extracted and transmitted to the cloud using Azure Data Factory to handle the migration. “We do have some tricky old 32-bit systems that don’t work within the Data Factory platform, but Microsoft always has a solution,” “So we’ve got a virtual machine that sits inside the architecture where we use some open-source Python scripts to connect to some of the more tricky infrastructure and do our ETL [extract, transform, load] that way.”After years of relying on spreadsheets and sales charts to Such visual toolsets add an entirely new element to pouring through, and understanding such vast quantities of data that might be collected by an international retail chain like Rip Curl. With the company now focused on setting its growth trajectory based on intelligent data insights, Rip Curl is presently integrating data points from its points of sale (POS) and from retail store counters – giving access to an in-depth range of data insights on When linked with Rip Curl’s e-commerce system and image database, Power BI can even visualize those data insights using images from Rip Curl’s inventory, rather than just looking at statistics on a spreadsheet. Power BI can also generate a delivery report so that store staff can see images of what is being delivered in each box and carton.“That’s great because we have a casual workforce and people have been with the business varying lengths of time. To come into the business, pick up that screen, see what’s expected in the box, and check it off, is something that I see a lot of demand for from the business,” said Connell.Connell stated that pilot projects are underway Connell saysLachlan Farran, the Group GM of Retail and Operations at Rip Curl, summed up the impact of that BI has had on his business: “BI has transformed the way we operate.  We now have a singular view of key customer drivers and understanding of product performance across a consistent real-time platform from in-store to head office.”",Rip Curl turns to intelligent data analytics to maintain its retail edge,https://techwireasia.com/2020/08/rip-curl-turns-to-intelligent-data-analytics-to-maintain-its-retail-edge/,17 August 2020
category,blurp,imgrul,text,title,url,date
Software,"Some might say data collection practices by tech companies are somewhat standardized now, even before we ever heard of contact tracing apps. Practically every website and internet-enabled device comes",https://cdn.techwireasia.com/wp-content/uploads/2020/09/shutterstock_1702177351-897x500.jpg,"Some might say data collection practices by tech companies are somewhat standardized now, even before we ever heard of contact tracing apps. Practically every website and internet-enabled device comes with its own set of Terms of Use, spelling out what information is being collected and how it is supposedly being used.It might even seem like we have been willingly giving away our right to withhold personal information for years now (who has read the full The public could be forgiven for having the above opinion, especially in 2020 when the global health crisis necessitated the existence of contact tracing solutions. Luckily, technology has evolved to a stage where digital tools are positively impacting virtually every aspect of the healthcare value chain. The BainWhile contact tracing apps could be seen as an extension of these critical services during a contagious crisis, questions around the user data collected abound. India’s contact tracing app, Aarogya Setu, has drawn attention for having a cloudy origin, but it has been downloaded 127.6 million times since being launched in early April.While some countries passed Controversially, Aarogya Setu also As generalized cluster data is sufficient to identify trends for other contact tracing apps, But there is no restriction on private companies or other organizations getting ahold of that data if they can make a case that they need it for research. In a similar loophole, Aarogya Setu is not mandatory to install, but certain residences, air and rail travel, and even certain courthouses require the app to permit entry.Following some backlash from the public, the Indian government has made some revisions to increase transparency and to narrow down the ways the data can be accessed, even in an anonymized form. The government also released the app’s source code, so the public could confirm what the data is being used for – but Finally, users can delete the app off their device. But it is still unclear if this will permanently delete all data off the government’s servers, or would users have to make a special application to delete their data, like what As of Monday, India has the second-highest active coronavirus rate, with over 90,000 new cases. While contact tracing is an active concern, should it take a backseat to data privacy considerations?When “Now, when a person is capable of infecting 50 others, will you think about the privacy of the person or about protecting the lives of the people? So, we have to balance everything.”",India’s contact tracing app raises questions on data freedoms,https://techwireasia.com/2020/09/indias-contact-tracing-app-raises-questions-on-data-freedoms/,9 September 2020
Software,"Computer vision is enabling systems to understand visual components — or, in a more poetic sense, it’s giving machines eyesight.The technology is an innovative branch of machine learning, enabling com",https://cdn.techwireasia.com/wp-content/uploads/2020/08/shutterstock_1355496497-1-897x500.jpg,"Computer vision is enabling systems to understand visual components — or, in a more poetic sense, it’s giving machines eyesight.The technology is an innovative branch of machine learning, enabling computers to identify and classify objects using image or video recognition. This technology is proving incredibly powerful and is fast advancing and gaining momentum rapidly across various use cases and industries.By understanding, analyzing, and extracting meaningful data from images faster and more accurately than humans, computer vision’s use cases span often controversial use in anything from facial recognition systems to identifying hairline flaws in manufacturing and identifying anomalies from MRI scans.Computer vision is also fundamental to the development of cutting-edge robotics, including autonomous vehicles and drones, that can ‘see’ and act on their surroundings. In short, the technology is enabling technologists to push new boundaries across a massive expanse of sectors, such as defense, manufacturing, retail, insurance, and retail.Here are some of the more interesting use cases of computer vision currently at play:Use of computer vision with CCTV systems may be unnerving and, in some cases, plain controversial. A number of tech giants, including IBM, have publicly backed away from offering its technology to law enforcement, But computer vision used in surveillance systems isn’t just about spying on citizens or holding criminals to account. Construction sites can employ the technology to identify when workers or vehicles are straying into dangerous, off-limit zones, sounding an alert to the individual on the ground, or even sending a signal that shuts off machinery.Computer vision also has the ability to ensure safety at large and crowded public events, such as identifying a risk of overcrowding, and triggering digital displays with prompts to move back, or signposting to areas of more space.At the Roland Garros tennis tournament in Paris this year, mobile operator Orange piloted use of real-time analysis of CCTV images using CV to enable staff to guide visitors to their seats, reducing the risks of overcrowding and improving the sports fans’ visitor experience.In these types of scenarios, edge computing enables both near real-time response, but also privacy, with images being processed locally on a private network on site.Downtime is a sin in manufacturing, and that puts the sector on a constant quest to employ technologies that speed up time-to-market while ensuring quality is optimized. Computer vision can remove and far out-perform the role of humans from the process of quality control, adding accuracy and repeatability to what is otherwise a monotonous task.Every successful manufacturer will have a rigorous quality control process in place but in certain highly-regulated industries, such as Aviation, Space, and Defense Industry, the stakes of a flaw in a product can risk not just reputation but could pose a serious threat to human lives. 3D-enabled computer vision systems can identify the smallest defect in a component that the human eye might miss.Even in the pharmaceutical industry, computer vision is being used to detect and analyze bacterial growth in Petri dishes containing samples of vaccines in production. This is proving a more accurate and effective alternative human inspection in detecting production problems and ultimately can bring medicines and vaccines into circulation faster.Optical character recognition (OCR) is another subset of computer vision that can identify characters from handwritten, typed, or printed text and turn it into machine-readable text. This can transform data-entry tasks where masses of data in disparate formats is collected and must be decoded constantly.OCR has replaced the need, in many cases, for humans to scour through and manually index scanned paper documents.If an insurance company is receiving more than 20 million documents a day, for example — a large volume of which could be emergencies which would require urgent attention — OCR can identify data while Another application of OCR is in extracting valuable, forgotten information from banks of legacy data that organizations may have generated over decades. The found data can subsequently be used by artificial intelligence and machine learning systems to make predictions. It may also be used to paw through medical records in efforts to uncover recurring cases of illnesses for example.",Computer vision — three exciting ways it’s changing business,https://techwireasia.com/2020/08/computer-vision-three-exciting-ways-its-changing-business/,27 August 2020
Software,"Like many other urban cities in Southeast Asia, Malaysia’s capital Kuala Lumpur is currently undergoing a major population spurt, and it is placing a significant strain on the With the population of K",https://cdn.techwireasia.com/wp-content/uploads/2020/08/shutterstock_572178319-897x500.jpg,"Like many other urban cities in Southeast Asia, Malaysia’s capital Kuala Lumpur is currently undergoing a major population spurt, and it is placing a significant strain on the With the population of Kuala Lumpur proper expected to hit 2.2 million people by the end of 2020, and the wider Klang Valley metropolitan area adding another 6 million residents from the outskirts surrounding the capital, the district’s transit authority Mass Rapid Transit Corporation (MRT Corp) decided to extend its overhead, underground, and street-level rail lines to cover a larger area of Malaysia’s sprawling urban center.Continuing the work from the first phase of the ambitious MRT project in Malaysia, the Sungai Buloh-Kajang (SBK) rail line, MRT Corp kicked off its next phase beginning 2017 with the brand new, 52 kilometer Sungai Buloh–Serdang–Putrajaya (SSP) rail line – one of the largest public transportation projects ever in Asia.“One of the key challenges faced with any mega civil construction project like ours is ensuring seamless information exchange and real-time collaboration, regardless of the platforms they are using,” The MRT Corp first implemented building information modeling (BIM) to allow for increased cohesion between design, construction, and accuracy of building information which could be vital to maintaining precision on a grand-scale construction project that involves a lot of interconnected components.The contractors, designers, ad builders used a variety of modeling tools to build digital environments and to do construction planning, and a lot of communication is digitized nowadays as well. To create a common data environment, MRT Corp turned to The partners are able to better leverage cloud-hosted services, making use of Bentley’s information management and collaboration platform ProjectWise, along with AssetWise, a software for managing accurate information funnels, ensuring accurate delivery and proper change management protocols.All of the Bentley software is hosted on Microsoft’s Azure, enabling upwards of 1,500 users to work together on around 7,500 digital models and more than 280,000 documents and drawings, equivalent to 2.3 terabytes of project data.“The Azure-hosted Bentley Systems platform enabled MRT Corp to increase precision of construction, reduce instances of design rework and to improve safety standards by enabling seamless synchronization and information exchange between external vendors. It has enabled all project disciplines to work dynamically using a federated model for coordinated design, despite the participation of numerous external vendors and decentralized information on this complex project,” read a MRT Corp director of planning and design Poh Seng Tiok said in the statement: “One of the key challenges faced with any mega civil construction project like ours is ensuring seamless information exchange, and real-time collaboration among stakeholders, regardless of the platforms they are using.”“The probability for error is high if information is not managed on a common data environment, especially in a highly collaborative project like ours. These types of errors could lead to construction delays and increased costs, due to change orders and rework to rectify issues,” Poh said.",Malaysia’s Mass Rapid Transit system comes together in the cloud,https://techwireasia.com/2020/08/malaysias-mass-rapid-transit-system-comes-together-in-the-cloud/,26 August 2020
Software,"2020 has presented a seismic shift in the way businesses must support their customers. It now needs to be online, available at any time, and it needs to be fast.Messengers are proving valuable channel",https://cdn.techwireasia.com/wp-content/uploads/2020/08/shutterstock_1064958395-897x500.jpg,"2020 has presented a seismic shift in the way businesses must support their customers. It now needs to be online, available at any time, and it needs to be fast.Messengers are proving valuable channels to support customers in a way that is natural to them. The approach can enable customer service teams to deliver fast, friendly and personal support. But to cater for a higher volume of support requests, many businesses are turning to chatbots and automation technology.Well-designed chatbots are the key to scaling conversational support, but there’s a lot of debate around what makes a good chatbot. Many guides advise starting by designing a ‘persona’ for your bot — find a cute avatar that’s on brand, choose a name, maybe teach it some witty banter. This can be a big-time investment, and should actually be bottom of the list. The customer isn’t looking for a chatbot to be their friend. It’s much more important whether the bot can actually give them the information they need — and it should stay out of the way if it can’t.Great bots start with a set of principles. Good principles serve as an enduring foundation for decisions, allowing the focus to stay on the customer experience. Chatbots have shown huge promise for resolving support issues from the beginning: customers save time, and businesses save money — a clear win-win. But the sticky spot is designing bots that There are a few ways to avoid this. First, set expectations with customers. It’s a bad start when a bot says something as general as “Hi, what can I help you with today?”, as very few bots can help Instead, the bot should give hints as to what it If your platform supports it, the bot should quickly assess how likely it is that the user’s query can be resolved by an automated system. Bots are most helpful when it comes to common, simple queries that don’t require the bot to develop an understanding of complex issues. A good bot will proactively funnel complex, long-tail issues over to your human support team. If the bot can’t help, it should let the customer know early, and explicitly excuse itself. If customer support isn’t available, redirecting a customer to a help center is preferable to getting stuck going round-and-round with a bot that knows it can’t actually help you.Nothing leads to worse customer experience than someone feeling like they’re trapped in support jail. A well-designed bot will let customers exit at any time, even if there isn’t a human to talk to. Don’t be tempted to keep customers in the bot flow because you don’t have enough human support resources. Trapping the customer without a place to go, or building a navigation flow without a clear exit, is not good for the customer experience. Bad experiences lead to frustration, negative word-of-mouth, and an unwillingness to later engage with self-serve content that The best way to allow customers to exit the bot depends on context. The most obvious solution is to have an always-present button that lets the customer exit. But some less obvious features will work just as well. Consider designing your bot to say one thing and then stop unless spoken to again, or to bow out if a user ignores its prompts. This lets customers exit by default. You can also design your bot to recognize exit syntax — words like “exit” or “quit” or “go away” — that a customer may say. The end goal is to make it easy for a customer to leave the conversation if they need to — the responsibility lies with the business to facilitate this.Customer relationships are the cornerstone of business success, and you can’t build great customer relationships without great experiences and personal communication. The “personal” generally means communication that feels friendly, easy, and quick. From a technical standpoint, this means bots should have no artificial loading delays and no walls of text. Customers also shouldn’t have to hunt for answers through an endless tree or be encouraged to stay in a support interaction that can’t help them. If your bot has certain flows that some customers must follow to progress their request — for example, if the customer must answer questions about their company before talking to sales, or enter their product make and model before accessing technical support—these flows shouldn’t be triggered until they are needed. Don’t frontload them automatically to customers they aren’t relevant for. Similarly, if customers are sometimes required to grant privacy permissions, or authenticate, the bot should prompt for these only as needed.HOW CHATBOTS ARE MAKING BANKING MORE CONVERSATIONALThe impact of each individual delay is small, but taken together will add up to a support experience that feels either fast and respectful, or frustrating and uncaring. Customers will notice when this principle is followed: they’ve been jaded by waiting on hold while a voice tells them how much ‘their time is respected,’ so businesses that actually do follow this principle stand out.If you’re looking to design or use chatbots to improve your customer support, the best place to start is with customer-centric design principles. While technology is advancing rapidly, the foundations of good experiences will remain.This article was contributed by Fergal Reid (Ph.D.), Principal Machine Learning Engineer at ",How can we make chatbots that hit home with users?,https://techwireasia.com/2020/09/how-can-we-make-chatbots-that-hit-home-with-users/,1 September 2020
Software,"The DevOps is aimed at Red Hat’s chief agilist, Jen Krieger, DevOps is about the correlation of people, processes, and products to enable continuous delivery of value to end-users, and while Companies",https://cdn.techwireasia.com/wp-content/uploads/2020/08/shutterstock_1093170383-897x500.jpg,"The DevOps is aimed at Red Hat’s chief agilist, Jen Krieger, DevOps is about the correlation of people, processes, and products to enable continuous delivery of value to end-users, and while Companies can resort to Taking it a step further, organizations can push for AI/ML-powered DevOps for self-healing and self-managing processes, preventing abrupt disruptions and script breaks. Besides that, organizations can opt for AI to recommend solutions to write more efficient and resilient code, based on the analysis of past application builds and performance. The ability of AI and ML to scan through troves of data with higher precision will play an essential role in delivering better security. Through a centralized logging architecture, employees can detect and highlight any Communication is also a vital component in DevOps strategy, but it’s often one of the biggest challenges when organizations move to the methodology when so much information is flowing through the system. Using AI-powered technology like chatbots, certain comms channels can become more streamlined and proactive.Most importantly, DevOps backed with AI/ML technologies will deliver better customer experience. Interestingly, just like how AI/ML technologies can root out security threats in a network and provide a holistic view, the same ability can be applied to improving user experience. AI and ML can inspect user behavior in identifying the type of application modules and functions responsible for the heavy lifting. This knowledge will, in turn, guide the DevOps team to focus on areas essential for user experience, working on the core elements that will have a maximum impact upon a new version or release. The integration of AI/ML technologies opens up new streams and enhanced functions in DevOps processes but also, development and operations teams will be equipped with state-of-the-art resources and be at the forefront of innovation. ",How AI can optimize our approach to DevOps,https://techwireasia.com/2020/08/how-ai-can-optimize-our-approach-to-devops/,31 August 2020
Software,"With its other business units in the doldrums, China’s telecommunications heavyweight Huawei Technologies is concentrating on its growing Infrastructure-as-a-Service (IaaS) interests, primarily Huawei",https://cdn.techwireasia.com/wp-content/uploads/2020/07/shutterstock_1265343229-897x500.jpg,"With its other business units in the doldrums, China’s telecommunications heavyweight Huawei Technologies is concentrating on its growing Infrastructure-as-a-Service (IaaS) interests, primarily Huawei Cloud, as the tech giant angles to secure its survivalThe market-leading telecoms equipment maker is facing one of its most challenging business environments to date. A A prolonged ban on doing business with its American partners has effectively crippled Huawei’s once-thriving mobile device business, with Huawei’s senior officials informing its semiconductor suppliers in Taiwan that the Chinese company fears itsSimilarly, the company’s telecommunications equipment segment was booming not too long ago, even overtaking traditional market competitors like Ericsson and Nokia to become the undisputed leader in telecoms hardware. However, HuaweiFurther rounds of sanctions have also restricted Huawei and its semiconductor business HiSilicon fromBack in 2019, the fledgling Huawei Cloud had a bumper year, with the Chinese telecommunications and mobility giant dipping their toes into managed cloud services and saw success in a number of global markets. A GartnerHuawei Cloud is now accessible in over 45 territories and this includes dedicated cloud data centers in both Asia and the Americas from Singapore, Brazil to Chile, to Mexico and Peru. It has over 2,000 technology partners around the world who have collectively released around 3,500 cloud-based applications.Huawei Cloud itself has launched in excess of 200 cloud services and at least 190 cloud-based solutions including 43 Ascend-poweredThis mammoth growth has seen Huawei Cloud claw its way to the top, finding itself among the IaaS elite, becoming the third-biggest cloud provider in China, and the sixth-biggest globally. The strong performance of Huawei Cloud, plus the dwindling fortunes of its other businesses, has caused Huawei to give equal credence to its cloud unit as it does for its smartphones and telecoms gear interests, says theHOW TENCENT IS BRINGING THE STORM CLOUDS TO ARCH-RIVAL ALIBABAThe company is still growing itsThe global cloud infrastructure services market hit a record US$30.2 billion in Q1 2020,",Huawei looks to amp up cloud business in fight for survival,https://techwireasia.com/2020/09/huawei-looks-to-amp-up-cloud-business-in-fight-for-survival/,4 September 2020
