category,blurp,imgrul,text,title,url,date
None,"As part of its summer rollout, the FamilyMart convenience store chain (dubbed The robots are created and made by Tokyo-based robotics firm Beginning A",https://cdn.techwireasia.com/wp-content/uploads/2020/07/shutterstock_1632530653-897x500.jpg,"As part of its summer rollout, the FamilyMart convenience store chain (dubbed The robots are created and made by Tokyo-based robotics firm Beginning August, prolific store operator FamilyMart will begin a trial of the Telexistence bots at some of its Tokyo locations as a means to study ways to improve efficiency and reduce operating costs. This is specially pertinent in light of the COVID-19 pandemic and the restrictions it has put on limiting the number of humans gathered at particular locations.If the trial proceeds as expected, FamilyMart expects to roll out robotic store assistants in as many as 20 of its Tokyo outlets, out of 16,600 locations across Japan by 2022, Robots being tapped to automate processesOver time, the system’s The robotics maker also says that programmed retail machines could cost up to ten times more than its hardware alone, and take months to complete.At present, the human controllers can be situated anywhere and can be operated by most people. Telexistence chief executive Jin Tomioka explained that his company’s technology lets people sense and experience places other than where they are, a concept dubbed “telexistence” by the startup’s co-founder, University of Tokyo professor Susumu Tachi, around forty years ago.“There are about 1.6 million people in Japan, who for various reasons are not active in the workforce,” said Tomohiro Kano, FamilyMart’s general manager in charge of franchise development. In the future, robots either operated by humans or using AI trained on human behavior, could become more prevalent in retail and other industrialized sectors.This would be a boon in countries like rapidly-aging Japan, as well as for operations that have been forced to operate with a lesser number of people due to emergency restrictions, such as with the coronavirus outbreak.Telexistence chief Tomioka says that his firm has been contacted by hotels, restaurants and even gas and oil companies since the emergence of COVID-19 in Japan.Professor Takeo Kanade, an AI and robotics scientist at Carnegie Mellon University who joined Telexistence as an adviser in February, believes that upcoming telexistence robots could also be used in hospitals so doctors could perform operations from remote locations– but that it might take another two decades before before robots can work in people’s homes.“In order for robots to be really usable at home we really have to be able to communicate,” he said. “The fundamental thing that is lacking is knowing how humans behave.”Last month,",Japan’s FamilyMart hedges bets on in-store robots,https://techwireasia.com/2020/07/japans-familymart-hedges-bets-on-in-store-robots/,22 July 2020
None,The COVID-19 pandemic has accelerated the uptake of e-commerce and online sales channels as an alternative to physical store shopping around the world,https://cdn.techwireasia.com/wp-content/uploads/2020/07/shutterstock_240695005-897x500.jpg,"The COVID-19 pandemic has accelerated the uptake of e-commerce and online sales channels as an alternative to physical store shopping around the world, and in Australia, the picture is no different.While some brick-and-mortar retailers were well-positioned to transition towards online selling, others such as Kmart and popular department store David Jones Australia struggled to quickly shift their businesses online when the coronavirus induced a nationwide shutdown. Both popular retail chains’ web services were brutalized by users on The scathing reviews were unsettling for Australia’s most well-known store chain – in a bid to modernize, David Jones had been posting significant web sales increases over the past two years as the company turned towards a more digital shopping experience.“Whilst our stores remained open during the lockdown, our online store sales doubled. This sales growth, coupled with dispatch and delivery delays associated with the increased volumes, led to unprecedented demands on the customer services teams,” said Daniele Iezzi, the customer services general manager at David Jones and Country Road Group“We saw increases of up to 500% in customer contact. Call volumes increased so quickly that at one stage customers were telephoning us every two seconds. Needless to say, wait times for calls ballooned out to levels we weren’t comfortable with.”Gartner reportsFor David Jones Australia, the company has decided to support its growing online sales by moving its maligned customer service operations to run on Amazon Connect and Salesforce cloud-based systems, to better manage customer feedback and ensure customer fulfillment is taking priority.Customer services GM Iezzi told “This placed pressure on the customer services team. The increase in online sales drove a 50% growth in phone calls to the team with the main inquiry being related to order status,” explained Iezzi. “Coupled with outdated systems, this demand was creating an experience that didn’t live up to our customers’ expectations.”David Jones decided to retain its customer relationship services in-house rather than outsourcing them, allowing the company to have a more direct grasp of their customers’ expectations, and brought in Deloitte to build a new platform based on Amazon Connect and Salesforce’s Service Cloud.Salesforce has repeatedly been ranked as one of the top customer service and support software vendors, with David Jones Australia is also using Amazon Connect’s “If you’re ringing to check on the status of your order, Amazon Connect will locate the order in your Salesforce profile, confirm its details with you, and then [make] an API call to our order management system and to our delivery partners [to] relay the order status to you, without the need for human intervention,” he continued. “This is really powerful as order status inquiries are still the main source of customer contacts to our team.”For out-of-hours calls, the system will create an ‘unresolved case’ in Service Cloud, filling in the details and reason for the call automatically. Amazon Connect can also determine to transfer calls to an agent, by looking at the customer’s profile info in Salesforce, identifying the caller by their phone number.The digital customer care platform has provided David Jones some of the space to pivot to additional support channels, such as transitioning store staff who were not working much during the lockdown, and redeploying them to handle excess online queries.“One of the great features of Amazon Connect and Service Cloud is the flexibility to scale up quite easily,” noted GM Iezzi. “As a result, we could redeploy these team members quickly using their own devices, and we could call on team members from any state to work with us remotely. They were able to hit the ground running.”In addition, David Jones Australia also increased its live chat and chatbot capacities, including using chatbots to better understand customer intent early and to obtain necessary customer information “such as their name, a case number or product information, helped reduce our handling time, and increase agent productivity in chat.”Iezzi says the capabilities of Amazon Connect and Salesforce allowed the retailer to keep “every channel of communication open” despite customer care agents undergoing the transition to work-from-home during Australia’s lockdown period.Buoyed by the recent customer response improvements, David Jones plans to identify opportunities “to automate further customer intents so that we can deflect more calls away from the customer services team.”“As we continue to leverage the power of Amazon Connect used in conjunction with Service Cloud, we will continue to gather information and insights about our customers, as each contact creates a case in the customer’s profile in Salesforce,” said Iezzi.David Jones is also planning to provide better tools to supplement the customer’s in-store experiences as well. “We’re looking to implement chat and messaging in-store,” Iezzi confirmed. “This will give customers more options in how they’d like to engage with our store teams, and allow sales assistants to view their customer’s shopping history, allowing them to sell the right product more easily and more efficiently. Naturally, this will be integrated with Service Cloud.”",Why Aussie department store David Jones went cloudwards for CX,https://techwireasia.com/2020/07/why-aussie-department-store-david-jones-went-cloudwards-for-cx/,23 July 2020
None,A smart mobility tech firm from Singapore has teamed up with Toyota Motor Philippines to kick off the first corporate smart transportation solution in,https://cdn.techwireasia.com/wp-content/uploads/2020/07/shutterstock_1019944984-897x500.jpg,"A smart mobility tech firm from Singapore has teamed up with Toyota Motor Philippines to kick off the first corporate smart transportation solution in the Philippines.The first client is KMC Solutions, the largest co-working and staff leasing service provider in the Philippines.Singapore-based SWAT Mobility is providing its IoT- and AI-powered solution to enable KMC Solutions employees to book rides within the bustling Metro Manila area, via its SWATBiz app.SWAT saw the hectic Metro Manila area as a perfect testbed to launch its inaugural corporate transportation method, as the congested metropolitan area is rife with traffic headaches which SWAT Mobility believes it is uniquely suited to handle.According to the The TomTom report noted that Filipinos lost 10 days and 17 hours for driving during rush hour over the year. In addition, 29 minutes are added per 30-minute trip in the morning rush, and additional 38 minutes per 30-minute trip while driving in the evening, effectively doubling travel times during peak periods.Between the road traffic congestion and the outmoded and overstrained rail transit systems, it was felt by some quarters that Metro Manila is in a ‘“Deploying in the Philippines is especially meaningful because we can directly impact people’s lives by significantly reducing their commute time,” stated Jarrold Ong, SWAT Mobility’s CEO. “Intelligent transport solutions like ours help fill the gaps in urban transport systems; when applied on a larger scale, we can improve congestion levels and quality of life for people in the Philippines.”KMC Solutions had implemented shuttle services for its employees and clients, with public transportation limited by the coronavirus pandemic. But the company found that its administrative staff were spending nights and weekends taking bookings, planning, and manually reporting transport arrangements for the shuttles, according to Alex Gomez, vice-president for people and culture at KMC.SWAT says with its system employees can track their bus right to the pick-up point, and not have to brave the long lines at Metro Manila’s rail stations or pack themselves into overflowing jeepneys. The mobility startup claims it automates approximately 90% of the manual tasks in managing a corporate shuttle fleet, and has managed to increase fleet efficiency by 20 to 30%.In a Through the SWATBiz app (the passenger app is available in both the In addition to the passenger mobile app, the SWAT Mobility ecosystem of integrated services is completed with the SWATBiz Driver app, and the Operations Interface that manages the interoperability between the applications as well as provides real-time monitoring, reporting, setup of new services, and analysis of past trips.KMC Solutions signed up to be the first business client in the Philippines, as the co-working and talent resource firm realized it needed to adapt to new working and traveling norms for its staff, as ",Smart mobility app eases corporate travel in Manila,https://techwireasia.com/2020/07/smart-mobility-app-eases-corporate-travel-in-manila/,21 July 2020
None,The United Nations Sustainable Development Solutions Network (UN SDSN) Youth Philippines is collaborating with tech heavyweight IBM to reinforce its C,https://cdn.techwireasia.com/wp-content/uploads/2020/07/shutterstock_322013945-897x500.jpg,"The United Nations Sustainable Development Solutions Network (UN SDSN) Youth Philippines is collaborating with tech heavyweight IBM to reinforce its COVID-19 information platform, to cope with rising traffic demands.IBM announced the partnership, which sees the Filipino pandemic site using IBM Watson Assistant, a conversational SDSN Youth is a global non-governmental movement organized by the UN to educate young people on the United Nation’s sustainable development goals, which in the Philippines includes education on sanitation and clean water, fostered through the use of integrated platforms where youth can connect and exchange ideas on collaboration projects.As a part of the official UN Taskforce on COVID-19 response, SDSN Youth Philippines created theSince being deployed, the average daily conversations being handled by the IBM Watson-powered virtual assistant have increased by 1050% as compared to the previous Q&A platform the site was using. The chatbot is hosted on IBM’s public cloud, and makes use of state-of-art enterprise AI search capabilities via Watson Discovery, to understand and respond to common questions surrounding the outbreak.“Having the Watson Discovery to search through other reputable sources has also further increased the wealth of information we can share with our users,”IBM Watson Assistant is equipped to answer a wide range of pre-trained information, and continuously learns the more it is utilized. The virtual agent leverages trusted information sources including the World Health Organization (WHO) and the U.S. Center for Disease Control & Prevention (CDC) to learn information and to develop its responses, ranging from COVID-19 symptoms, testing information, and public service information. Organizations that use IBM Watson Assistant can also train to recognize other intents, by selecting from IBM’s content catalogue.“In these unprecedented times, access to accurate information plays a critical role in allaying fears, dispelling myths, and building trust among citizens. I am excited to see today’s Filipino youth proactively playing a part in making a difference in today’s different normal brought about by this pandemic,” commented Aileen Judan-Jiao, IBM Philippines President and Country General Manager, in a statement. “This bears testimony to our commitment to lend IBM’s technology, resources, and people, to support Filipinos with easy access to trusted, relevant information from reliable sources. IBM is the innovation partner to businesses, governments, and citizens across the world, and is committed to marshaling its resources, technology, and expertise towards initiatives that help to manage COVID-19 outbreak.”IBM has been supporting a variety of government agencies, healthcare organizations, academic institutions, businesses and NGOs throughout this health crisis, leveraging its “We are currently offering Watson Assistant to local government agencies, businesses, hospitals or other healthcare organizations while assisting with the initial set up, which can typically be done in just a few days,” added IBM Philippines’ Judan-Jiao. “Organizations can customize the solution to address questions specific to their city or region or integrate IBM Watson Assistant to its existing back-end ERP systems.”",UN in Philippines uses IBM AI to power pandemic info platform,https://techwireasia.com/2020/07/un-in-philippines-uses-ibm-ai-to-power-pandemic-info-platform/,20 July 2020
None,"Cities around the world are looking to leverage innovative technologies to improve the efficiency of local city services, create healthier urban envir",https://cdn.techwireasia.com/wp-content/uploads/2020/07/Aerodyne-Celcom-partnership-897x500.jpg,"Cities around the world are looking to leverage innovative technologies to improve the efficiency of local city services, create healthier urban environments, and to create more sustainable features in areas including transportation, utilities, and public services.These smart city initiatives require collaboration between the private and public sectors in order to be effectively deployed, and to that end, Malaysian digital tech solutions provider Aerodyne Group has agreed a The aim of the partnership? To explore the development of drone technology.In a joint statement released last week, both entities affirmed their mutual dependence on telecommunications technology, but increasingly automation, artificial intelligence (AI), machine learning (ML) and 5G technology. The two groups will be looking to co-develop innovative solutions with potential applications for Aerodyne, which has been With the MoU signing, past Aerodyne applications will also be progressively powered by Celcom.Aerodyne and its working partners will also be able to participate in next-generation research and development in telecommunications technologies being headed up by Celcom’s Celcom has previously invested in Aerodyne, and the new MoU could see Celcom expanding its ecosystem of B2B solutions by adding Aerodyne drone tech as well. Idham Nawawi, the chief executive officer of Celcom Axiata Bhd, said that the company wants to work with a variety of technology partners, especially local startups, as the Malaysian telecom giant aims to become a leading IR4.0 technology adoption enabler.“The affiliation with local technology companies such as Aerodyne is a part of Celcom’s strategy towards stronger digital advocacy to aspiring local digital and technology entrepreneurs.” Nawawi said, adding that the initiative is a continuation to the support provided by Axiata Digital Fund (ADIF).“We hope to develop more similar collaborations to continuously inspire Malaysians technology entrepreneurs and startups into faster adoption of Internet of Things (IoT) and AI solutions, and at the same time contribute to the building of an inclusive local digital ecosystem.”Aerodyne’s AI-driven asset management and data-gathering tech could see immediate adoption in Similarly, the To maximize the efficiencies that the drone technology is capable of, a high speed connection that the likes of 5G can provide will be required. Aerodyne Group’s founder and group chief executive officer, Kamarul A Muhamed said: “We are excited about this strategic partnership with Celcom as our preferred connectivity provider to jointly explore and develop smart solutions using drones by leveraging on 5G technology.”“This will enable drones to transmit high definition footage in real-time,” he continued. “5G’s millisecond latency and data speeds of up to 100 times faster than 4G allows drones to transmit high-quality footage and data to operators on the ground.”",Celcom to co-develop 5G drone tech for smart cities and agritech,https://techwireasia.com/2020/07/celcom-to-co-develop-5g-drone-tech-for-smart-cities-and-agritech/,31 July 2020
category,blurp,imgrul,text,title,url,date
Automation,"The COVID-19 pandemic has accelerated the uptake of e-commerce and online sales channels as an alternative to physical store shopping around the world, and in Australia, the picture is no different.Wh",https://cdn.techwireasia.com/wp-content/uploads/2020/07/shutterstock_240695005-897x500.jpg,"The COVID-19 pandemic has accelerated the uptake of e-commerce and online sales channels as an alternative to physical store shopping around the world, and in Australia, the picture is no different.While some brick-and-mortar retailers were well-positioned to transition towards online selling, others such as Kmart and popular department store David Jones Australia struggled to quickly shift their businesses online when the coronavirus induced a nationwide shutdown. Both popular retail chains’ web services were brutalized by users on The scathing reviews were unsettling for Australia’s most well-known store chain – in a bid to modernize, David Jones had been posting significant web sales increases over the past two years as the company turned towards a more digital shopping experience.“Whilst our stores remained open during the lockdown, our online store sales doubled. This sales growth, coupled with dispatch and delivery delays associated with the increased volumes, led to unprecedented demands on the customer services teams,” said Daniele Iezzi, the customer services general manager at David Jones and Country Road Group“We saw increases of up to 500% in customer contact. Call volumes increased so quickly that at one stage customers were telephoning us every two seconds. Needless to say, wait times for calls ballooned out to levels we weren’t comfortable with.”Gartner reportsFor David Jones Australia, the company has decided to support its growing online sales by moving its maligned customer service operations to run on Amazon Connect and Salesforce cloud-based systems, to better manage customer feedback and ensure customer fulfillment is taking priority.Customer services GM Iezzi told “This placed pressure on the customer services team. The increase in online sales drove a 50% growth in phone calls to the team with the main inquiry being related to order status,” explained Iezzi. “Coupled with outdated systems, this demand was creating an experience that didn’t live up to our customers’ expectations.”David Jones decided to retain its customer relationship services in-house rather than outsourcing them, allowing the company to have a more direct grasp of their customers’ expectations, and brought in Deloitte to build a new platform based on Amazon Connect and Salesforce’s Service Cloud.Salesforce has repeatedly been ranked as one of the top customer service and support software vendors, with David Jones Australia is also using Amazon Connect’s “If you’re ringing to check on the status of your order, Amazon Connect will locate the order in your Salesforce profile, confirm its details with you, and then [make] an API call to our order management system and to our delivery partners [to] relay the order status to you, without the need for human intervention,” he continued. “This is really powerful as order status inquiries are still the main source of customer contacts to our team.”For out-of-hours calls, the system will create an ‘unresolved case’ in Service Cloud, filling in the details and reason for the call automatically. Amazon Connect can also determine to transfer calls to an agent, by looking at the customer’s profile info in Salesforce, identifying the caller by their phone number.The digital customer care platform has provided David Jones some of the space to pivot to additional support channels, such as transitioning store staff who were not working much during the lockdown, and redeploying them to handle excess online queries.“One of the great features of Amazon Connect and Service Cloud is the flexibility to scale up quite easily,” noted GM Iezzi. “As a result, we could redeploy these team members quickly using their own devices, and we could call on team members from any state to work with us remotely. They were able to hit the ground running.”In addition, David Jones Australia also increased its live chat and chatbot capacities, including using chatbots to better understand customer intent early and to obtain necessary customer information “such as their name, a case number or product information, helped reduce our handling time, and increase agent productivity in chat.”Iezzi says the capabilities of Amazon Connect and Salesforce allowed the retailer to keep “every channel of communication open” despite customer care agents undergoing the transition to work-from-home during Australia’s lockdown period.Buoyed by the recent customer response improvements, David Jones plans to identify opportunities “to automate further customer intents so that we can deflect more calls away from the customer services team.”“As we continue to leverage the power of Amazon Connect used in conjunction with Service Cloud, we will continue to gather information and insights about our customers, as each contact creates a case in the customer’s profile in Salesforce,” said Iezzi.David Jones is also planning to provide better tools to supplement the customer’s in-store experiences as well. “We’re looking to implement chat and messaging in-store,” Iezzi confirmed. “This will give customers more options in how they’d like to engage with our store teams, and allow sales assistants to view their customer’s shopping history, allowing them to sell the right product more easily and more efficiently. Naturally, this will be integrated with Service Cloud.”",Why Aussie department store David Jones went cloudwards for CX,https://techwireasia.com/2020/07/why-aussie-department-store-david-jones-went-cloudwards-for-cx/,23 July 2020
