category,blurp,imgrul,text,title,url,date
Networks,"The shortcomings and inefficiencies of global supply chains is apparent across many industries this year, with most cross-border supply routes being interrupted in one way or another.Moreover, recent ",https://cdn.techwireasia.com/wp-content/uploads/2020/09/shutterstock_1678273423-897x500.jpg,"The shortcomings and inefficiencies of global supply chains is apparent across many industries this year, with most cross-border supply routes being interrupted in one way or another.Moreover, recent comments suggest that relying too heavily on any one country or supplier for critical goods like medication is a recipe for disaster – and the same could be said when it comes to supplying critical materials of strategic importance to shared economies, such as the 5G equipment that will be used to build the next generation of networking infrastructure around the globe.Or at least, that is the outlook of Brent Christensen, the director of the American Institute in Taiwan (AIT) who made the comments at the International Investment Forum in Taipei last week, hosted by the Mergers and Acquisitions and Private Equity Council of Taiwan.In a transcript Christensen emphasized the importance of the US working with “like-minded partners” like Taiwan, Japan, and the EU, to design new supply chains based on “shared values” like Taiwan is an important cog in the hi-tech supply chain ecosystem, a manufacturer and supplier of critical components like semiconductor chips and cloud servers, for many of the biggest tech and electronics brands worldwide including those in the US and China. Taiwan’s most prolific manufacturer, the Taiwan Semiconductor Manufacturing Co (TSMC), recently severed its long-running ties with China’s 5G equipment market leader Huawei Technologies, following fresh American trade restrictions that explicitly prohibit the US and its allies from supplying Huawei with valuable tech components.TSMC’s decision to discontinue its Huawei relationship, combined with its“We would call these American values. We would also call them Taiwan values,” said Christensen. Huawei has been heavily in the sights of the US, amid allegations of state-endorsed spying on American businesses and end-users. By law, Chinese firms are compelled to turn over information, including user data, should the government request it.Christensen’s AIT had an eventful week, teaming up with the Taipei Economic and Cultural Representative Office in the US to issue a joint declaration on 5G security later that same week. Commenting on the US’ planned ‘Network hardware and software suppliers should not be subject, without independent judicial review, to control by a foreign government; suppliers should be financed openly and transparently; suppliers should have transparent ownership, partnerships, and corporate governance structures; and they should exemplify a commitment to innovation and respect for intellectual property rights.Taiwan’s Minister of Foreign Affairs, Joseph Wu, said the joint declaration shows the US-Taiwan partnership is cemented in the cybersecurity field as much as in 5G supply lines, and that Taiwan will continue cooperating with the US to develop Wu pointed out that all of Taiwan’s 5G suppliers — Chunghwa Telecom Co, Taiwan Mobile Co, Far EasTone Telecommunications Co, Asia Pacific Telecom Co, and Taiwan Star Telecom Co – align with the US’ standards for a “clean” 5G supply chain partner.","Taiwan, US forging 5G supply chain based on ‘shared values’",https://techwireasia.com/2020/09/taiwan-us-forging-5g-supply-chain-based-on-shared-values/,7 September 2020
category,blurp,imgrul,text,title,url,date
Productivity,"The COVID-19 pandemic has accelerated the uptake of e-commerce and online sales channels as an alternative to physical store shopping around the world, and in Australia, the picture is no different.Wh",https://cdn.techwireasia.com/wp-content/uploads/2020/07/shutterstock_240695005-897x500.jpg,"The COVID-19 pandemic has accelerated the uptake of e-commerce and online sales channels as an alternative to physical store shopping around the world, and in Australia, the picture is no different.While some brick-and-mortar retailers were well-positioned to transition towards online selling, others such as Kmart and popular department store David Jones Australia struggled to quickly shift their businesses online when the coronavirus induced a nationwide shutdown. Both popular retail chains’ web services were brutalized by users on The scathing reviews were unsettling for Australia’s most well-known store chain – in a bid to modernize, David Jones had been posting significant web sales increases over the past two years as the company turned towards a more digital shopping experience.“Whilst our stores remained open during the lockdown, our online store sales doubled. This sales growth, coupled with dispatch and delivery delays associated with the increased volumes, led to unprecedented demands on the customer services teams,” said Daniele Iezzi, the customer services general manager at David Jones and Country Road Group“We saw increases of up to 500% in customer contact. Call volumes increased so quickly that at one stage customers were telephoning us every two seconds. Needless to say, wait times for calls ballooned out to levels we weren’t comfortable with.”Gartner reportsFor David Jones Australia, the company has decided to support its growing online sales by moving its maligned customer service operations to run on Amazon Connect and Salesforce cloud-based systems, to better manage customer feedback and ensure customer fulfillment is taking priority.Customer services GM Iezzi told “This placed pressure on the customer services team. The increase in online sales drove a 50% growth in phone calls to the team with the main inquiry being related to order status,” explained Iezzi. “Coupled with outdated systems, this demand was creating an experience that didn’t live up to our customers’ expectations.”David Jones decided to retain its customer relationship services in-house rather than outsourcing them, allowing the company to have a more direct grasp of their customers’ expectations, and brought in Deloitte to build a new platform based on Amazon Connect and Salesforce’s Service Cloud.Salesforce has repeatedly been ranked as one of the top customer service and support software vendors, with David Jones Australia is also using Amazon Connect’s “If you’re ringing to check on the status of your order, Amazon Connect will locate the order in your Salesforce profile, confirm its details with you, and then [make] an API call to our order management system and to our delivery partners [to] relay the order status to you, without the need for human intervention,” he continued. “This is really powerful as order status inquiries are still the main source of customer contacts to our team.”For out-of-hours calls, the system will create an ‘unresolved case’ in Service Cloud, filling in the details and reason for the call automatically. Amazon Connect can also determine to transfer calls to an agent, by looking at the customer’s profile info in Salesforce, identifying the caller by their phone number.The digital customer care platform has provided David Jones some of the space to pivot to additional support channels, such as transitioning store staff who were not working much during the lockdown, and redeploying them to handle excess online queries.“One of the great features of Amazon Connect and Service Cloud is the flexibility to scale up quite easily,” noted GM Iezzi. “As a result, we could redeploy these team members quickly using their own devices, and we could call on team members from any state to work with us remotely. They were able to hit the ground running.”In addition, David Jones Australia also increased its live chat and chatbot capacities, including using chatbots to better understand customer intent early and to obtain necessary customer information “such as their name, a case number or product information, helped reduce our handling time, and increase agent productivity in chat.”Iezzi says the capabilities of Amazon Connect and Salesforce allowed the retailer to keep “every channel of communication open” despite customer care agents undergoing the transition to work-from-home during Australia’s lockdown period.Buoyed by the recent customer response improvements, David Jones plans to identify opportunities “to automate further customer intents so that we can deflect more calls away from the customer services team.”“As we continue to leverage the power of Amazon Connect used in conjunction with Service Cloud, we will continue to gather information and insights about our customers, as each contact creates a case in the customer’s profile in Salesforce,” said Iezzi.David Jones is also planning to provide better tools to supplement the customer’s in-store experiences as well. “We’re looking to implement chat and messaging in-store,” Iezzi confirmed. “This will give customers more options in how they’d like to engage with our store teams, and allow sales assistants to view their customer’s shopping history, allowing them to sell the right product more easily and more efficiently. Naturally, this will be integrated with Service Cloud.”",Why Aussie department store David Jones went cloudwards for CX,https://techwireasia.com/2020/07/why-aussie-department-store-david-jones-went-cloudwards-for-cx/,23 July 2020
Productivity,"The DevOps is aimed at Red Hat’s chief agilist, Jen Krieger, DevOps is about the correlation of people, processes, and products to enable continuous delivery of value to end-users, and while Companies",https://cdn.techwireasia.com/wp-content/uploads/2020/08/shutterstock_1093170383-897x500.jpg,"The DevOps is aimed at Red Hat’s chief agilist, Jen Krieger, DevOps is about the correlation of people, processes, and products to enable continuous delivery of value to end-users, and while Companies can resort to Taking it a step further, organizations can push for AI/ML-powered DevOps for self-healing and self-managing processes, preventing abrupt disruptions and script breaks. Besides that, organizations can opt for AI to recommend solutions to write more efficient and resilient code, based on the analysis of past application builds and performance. The ability of AI and ML to scan through troves of data with higher precision will play an essential role in delivering better security. Through a centralized logging architecture, employees can detect and highlight any Communication is also a vital component in DevOps strategy, but it’s often one of the biggest challenges when organizations move to the methodology when so much information is flowing through the system. Using AI-powered technology like chatbots, certain comms channels can become more streamlined and proactive.Most importantly, DevOps backed with AI/ML technologies will deliver better customer experience. Interestingly, just like how AI/ML technologies can root out security threats in a network and provide a holistic view, the same ability can be applied to improving user experience. AI and ML can inspect user behavior in identifying the type of application modules and functions responsible for the heavy lifting. This knowledge will, in turn, guide the DevOps team to focus on areas essential for user experience, working on the core elements that will have a maximum impact upon a new version or release. The integration of AI/ML technologies opens up new streams and enhanced functions in DevOps processes but also, development and operations teams will be equipped with state-of-the-art resources and be at the forefront of innovation. ",How AI can optimize our approach to DevOps,https://techwireasia.com/2020/08/how-ai-can-optimize-our-approach-to-devops/,31 August 2020
Productivity,"Small-medium enterprises (SMEs) underpin economies around the world. That’s why, faced by a looming recession, getting them back on their feet is a key priority for governments and large businesses al",https://cdn.techwireasia.com/wp-content/uploads/2020/08/shutterstock_1088472854-897x500.jpg,"Small-medium enterprises (SMEs) underpin economies around the world. That’s why, faced by a looming recession, getting them back on their feet is a key priority for governments and large businesses alike.With Southeast Asia Singapore is injecting In China, IT heavyweights including Gojek has launched its Digital-first services like its business management application GoBiz, e-wallet GoPay, food delivery app GoFood, and e-commerce service GoShop, are all part of the incentive package. Alongside these, Gojek is offering multiple training programs and community partnerships, including payment support with QRIS and Link Aja, as well as logistics providers Pos Indonesia, Paxel, and JNE, to help newly-digitalized SMEs complete their order fulfilments with limited contact with the end customer.“It is very important for conventional MSMEs to transform into digital businesses so that they can adapt according to changes in consumer behavior who are now using more digital platforms to meet all their needs,” Soelistyo cited research from the Demographic Institute of the Faculty of Economics and Business, University of Indonesia, which found that a major majority of 94% of MSMEs who started going digital with the Gojek ecosystem were micro-businesses, while less than half (43%) were startup entrepreneurs.Last month, Gojek Gojek’s initiative is similar to that of competitor Grab’s. The “COVID-19 has accelerated change. We have seen dependency on online services grow exponentially almost overnight,” said Hooi Ling Tan, co-founder of Grab.“This is spurring innovation in Southeast Asia, but is also putting us at risk of widening the digital divide. Small businesses make up the backbone of Southeast Asia’s economy, but the vast majority of these businesses are offline.” ",Gojek wants to spark up small businesses in Indonesia,https://techwireasia.com/2020/08/gojek-wants-to-spark-up-small-businesses-in-indonesia/,25 August 2020
Productivity,"The global air travel industry has been badly rocked by flying restrictions and airport shutdowns around the world in the past few months, but that has not stopped airlines from planning for their ret",https://cdn.techwireasia.com/wp-content/uploads/2020/08/shutterstock_347983433-897x500.jpg,"The global air travel industry has been badly rocked by flying restrictions and airport shutdowns around the world in the past few months, but that has not stopped airlines from planning for their return to more regular operations by investing in promising digital acceleration initiatives. That is exactly what Malaysian budget carrier AirAsia announced last week that it will be adopting JIFFY.ai’s RPA platform that leverages artificial intelligence (AI), machine learning, and natural language processing (NLP) to automate an organization’s tasks and processes, helping to create both time and efficiencies in the long run.“The implementation leverages JIFFY.ai’s AirAsia chief transformation officer Azli Mohamed was quoted as saying that the implementation of RPA followed a review of AirAsia’s internal processes and workflows, which showed that business or robotic process automation can be “At AirAsia, we continuously seek to push the boundaries of innovation. RPA will allow our workforce to automate mundane and repetitive tasks, which will free up valuable time to focus on other tasks that require thinking and experience-based judgment,” Mohammed said.AirAsia kicked off its present phase of digital transformation goals back in 2016, and the popular budget airline has been ramping up digital-first targets all across the company during the past few lean months, where local travel has only been reinstated for less than two months, and international flights are still grounded. Carriers in the Asia Pacific (APAC) region are expected to lose up to US$113 billion in revenue this year, data from the No doubt looking to “With the contactless kiosks, guests making their essential travel can print their boarding pass and baggage tag after checking-in online on airasia.com or through the mobile app, ensuring a full These include enhanced features on the AirAsia mobile app and contactless kiosks with The AirAsia statement also pointed out that robotic process automation was being adopted by the AirAsia Group in stages, as the automation process befits the internal functionality and requirements of the individual departments.“RPA will enable us to increase productivity, reduce errors, and redeploy resources to higher-value functions. All these benefits will ultimately translate into sizable cost savings and top-line revenue growth,” Azli said.AirAsia’s commission of the Kerala-based RPA startup was a major coup for JIFFY.ai, who also released a “We are delighted to have been chosen as the partner for AirAsia to help them on their digital transformation journey,” commented Babu Vinod Sivadasan, the co-founder and CEO of JIFFY.ai. “The JIFFY.ai automate platform is expandable and extensible and will give them the intelligent automation power they need to streamline and improve complex business processes while supporting innovation to help the business grow.”",AirAsia redirects its business priorities using robotic process automation,https://techwireasia.com/2020/08/airasia-redirects-its-business-priorities-using-robotic-process-automation/,18 August 2020
Productivity,"The COVID-19 pandemic is easing around the world and, for the most part, organizations are settling down to the challenging task of rebuilding their businesses in the new economic reality.Many enterpr",https://cdn.techwireasia.com/wp-content/uploads/2020/07/shutterstock_1517650652-897x500.jpg,"The COVID-19 pandemic is easing around the world and, for the most part, organizations are settling down to the challenging task of rebuilding their businesses in the new economic reality.Many enterprises are resuming regular office operations, while others are persisting with remote working arrangements. Others still are reconnecting disrupted supply chains, or getting back in touch with salespeople or business partners located in different towns or countries altogether.One thing all companies have in common is that remaining reliably connected will be integral to resuming some semblance of regular working arrangements.Here in Asia, where the uneven distribution of communications tools is a rule rather than an exception, telecommunications service providers have proven invaluable, not only in helping enterprises stay connected in spite of new work requirements, but in pushing the quality of digitalized services and offerings in a shorter time span, to meet mounting customer needs.Tata Communications last month announced that its Asia Direct Cable (ADC) Consortium is building a high-performance submarine cable connecting China (Hong Kong SAR and Guangdong Province), Japan, the Philippines, Singapore, Thailand, and Vietnam.The firm was one of the early initiators of the ADC, and its high capacity optical fibers can carry 140 Tbps of traffic, enabling high capacity transmission of data across the East Asian and Southeast Asian regions, and supplying an additional route to connect with Tata Communications’ existing global network.Tech Wire AsiaTata Communications sees itself as a “Data is the new currency, the new oil… we can confidently say that 90% of the data that we see today was created in the past two years, because that is the rate at which we are accelerating on the creation of data,” said Srinivasan, commenting on the quicker pace of today’s data-driven intelligent systems.Tata Communications’ data insights are driven by artificial intelligence (AI) and machine learning (ML), and Srinivasan says these data analytics tools will be indispensable for enterprises looking to scale up their operations. “Because that will ensure the analytics is useful for the company to scale, by actually using algorithms that are smarter, that are faster, and can do the work consistently and self-learn – that’s where the scalability of the data will come from.”“I call those technologies the new members or new employees of every team. Because they need to be embraced, they need to be accepted, they need to be trained as you would do with any new employee,” he said.Tata Communications Next-generation tech advancements like cloud computing, Internet of Things (IoT) enabled connectivity, and AI are being increasingly embraced by organizations as they pivot towards digitalizing their systems and processes. While accelerating the company’s digital maturity, they will also consume much more data to function efficiently.Providers of high-performance connectivity capabilities are looking towards 5G to provide the performance robustness to The technology, he said, is an enabler of What digital-led trends did Tata see forming at the onset of the COVID-19 pandemic? “When COVID-19 started impacting places like India, workplaces obviously were seen as less safe from a proximity standpoint, so people started working from home,” noted digital chief Srinivasan.“That countered the [previous] data requirements of enterprises; we saw 650-plus [enterprise] customer orders for additional bandwidth augmentation” to cope with the additional demand during the pandemic.Meanwhile, and identified “I don’t know if it was a coincidence, but in the last three months, we have seen a lot more With the coronavirus still a threat in India, Srinivasan was hesitant to speculate about post-COVID digital transformation trends – but feels that a more rapid uptake of digitalization is inevitable for those enterprises that want to remain relevant.“Post-COVID is anyone’s guess, it’s crystal-gazing until things actually settle down, but from where I see things, I think digitalization is going to accelerate,” he said emphatically.“We’re going to see a massive acceleration of digital transformation – meaning more data, more connectivity, more security, because security is going to become ingrained in everything that we do.”",Is becoming a connected enterprise still possible in a post-COVID reality?,https://techwireasia.com/2020/07/pursuing-the-connected-enterprise-in-times-of-crisis-according-to-tata-communications/,30 July 2020
