category,blurp,imgrul,text,title,url,date
Automation,A smart mobility tech firm from Singapore has teamed up with Toyota Motor Philippines to kick off the first corporate smart transportation solution in the Philippines.The first client is KMC Solutions,https://cdn.techwireasia.com/wp-content/uploads/2020/07/shutterstock_1019944984-897x500.jpg,"A smart mobility tech firm from Singapore has teamed up with Toyota Motor Philippines to kick off the first corporate smart transportation solution in the Philippines.The first client is KMC Solutions, the largest co-working and staff leasing service provider in the Philippines.Singapore-based SWAT Mobility is providing its IoT- and AI-powered solution to enable KMC Solutions employees to book rides within the bustling Metro Manila area, via its SWATBiz app.SWAT saw the hectic Metro Manila area as a perfect testbed to launch its inaugural corporate transportation method, as the congested metropolitan area is rife with traffic headaches which SWAT Mobility believes it is uniquely suited to handle.According to the The TomTom report noted that Filipinos lost 10 days and 17 hours for driving during rush hour over the year. In addition, 29 minutes are added per 30-minute trip in the morning rush, and additional 38 minutes per 30-minute trip while driving in the evening, effectively doubling travel times during peak periods.Between the road traffic congestion and the outmoded and overstrained rail transit systems, it was felt by some quarters that Metro Manila is in a ‘“Deploying in the Philippines is especially meaningful because we can directly impact people’s lives by significantly reducing their commute time,” stated Jarrold Ong, SWAT Mobility’s CEO. “Intelligent transport solutions like ours help fill the gaps in urban transport systems; when applied on a larger scale, we can improve congestion levels and quality of life for people in the Philippines.”KMC Solutions had implemented shuttle services for its employees and clients, with public transportation limited by the coronavirus pandemic. But the company found that its administrative staff were spending nights and weekends taking bookings, planning, and manually reporting transport arrangements for the shuttles, according to Alex Gomez, vice-president for people and culture at KMC.SWAT says with its system employees can track their bus right to the pick-up point, and not have to brave the long lines at Metro Manila’s rail stations or pack themselves into overflowing jeepneys. The mobility startup claims it automates approximately 90% of the manual tasks in managing a corporate shuttle fleet, and has managed to increase fleet efficiency by 20 to 30%.In a Through the SWATBiz app (the passenger app is available in both the In addition to the passenger mobile app, the SWAT Mobility ecosystem of integrated services is completed with the SWATBiz Driver app, and the Operations Interface that manages the interoperability between the applications as well as provides real-time monitoring, reporting, setup of new services, and analysis of past trips.KMC Solutions signed up to be the first business client in the Philippines, as the co-working and talent resource firm realized it needed to adapt to new working and traveling norms for its staff, as ",Smart mobility app eases corporate travel in Manila,https://techwireasia.com/2020/07/smart-mobility-app-eases-corporate-travel-in-manila/,21 July 2020
Automation,"As part of its summer rollout, the FamilyMart convenience store chain (dubbed The robots are created and made by Tokyo-based robotics firm Beginning August, prolific store operator FamilyMart will beg",https://cdn.techwireasia.com/wp-content/uploads/2020/07/shutterstock_1632530653-897x500.jpg,"As part of its summer rollout, the FamilyMart convenience store chain (dubbed The robots are created and made by Tokyo-based robotics firm Beginning August, prolific store operator FamilyMart will begin a trial of the Telexistence bots at some of its Tokyo locations as a means to study ways to improve efficiency and reduce operating costs. This is specially pertinent in light of the COVID-19 pandemic and the restrictions it has put on limiting the number of humans gathered at particular locations.If the trial proceeds as expected, FamilyMart expects to roll out robotic store assistants in as many as 20 of its Tokyo outlets, out of 16,600 locations across Japan by 2022, Robots being tapped to automate processesOver time, the system’s The robotics maker also says that programmed retail machines could cost up to ten times more than its hardware alone, and take months to complete.At present, the human controllers can be situated anywhere and can be operated by most people. Telexistence chief executive Jin Tomioka explained that his company’s technology lets people sense and experience places other than where they are, a concept dubbed “telexistence” by the startup’s co-founder, University of Tokyo professor Susumu Tachi, around forty years ago.“There are about 1.6 million people in Japan, who for various reasons are not active in the workforce,” said Tomohiro Kano, FamilyMart’s general manager in charge of franchise development. In the future, robots either operated by humans or using AI trained on human behavior, could become more prevalent in retail and other industrialized sectors.This would be a boon in countries like rapidly-aging Japan, as well as for operations that have been forced to operate with a lesser number of people due to emergency restrictions, such as with the coronavirus outbreak.Telexistence chief Tomioka says that his firm has been contacted by hotels, restaurants and even gas and oil companies since the emergence of COVID-19 in Japan.Professor Takeo Kanade, an AI and robotics scientist at Carnegie Mellon University who joined Telexistence as an adviser in February, believes that upcoming telexistence robots could also be used in hospitals so doctors could perform operations from remote locations– but that it might take another two decades before before robots can work in people’s homes.“In order for robots to be really usable at home we really have to be able to communicate,” he said. “The fundamental thing that is lacking is knowing how humans behave.”Last month,",Japan’s FamilyMart hedges bets on in-store robots,https://techwireasia.com/2020/07/japans-familymart-hedges-bets-on-in-store-robots/,22 July 2020
Automation,"2020 has presented a seismic shift in the way businesses must support their customers. It now needs to be online, available at any time, and it needs to be fast.Messengers are proving valuable channel",https://cdn.techwireasia.com/wp-content/uploads/2020/08/shutterstock_1064958395-897x500.jpg,"2020 has presented a seismic shift in the way businesses must support their customers. It now needs to be online, available at any time, and it needs to be fast.Messengers are proving valuable channels to support customers in a way that is natural to them. The approach can enable customer service teams to deliver fast, friendly and personal support. But to cater for a higher volume of support requests, many businesses are turning to chatbots and automation technology.Well-designed chatbots are the key to scaling conversational support, but there’s a lot of debate around what makes a good chatbot. Many guides advise starting by designing a ‘persona’ for your bot — find a cute avatar that’s on brand, choose a name, maybe teach it some witty banter. This can be a big-time investment, and should actually be bottom of the list. The customer isn’t looking for a chatbot to be their friend. It’s much more important whether the bot can actually give them the information they need — and it should stay out of the way if it can’t.Great bots start with a set of principles. Good principles serve as an enduring foundation for decisions, allowing the focus to stay on the customer experience. Chatbots have shown huge promise for resolving support issues from the beginning: customers save time, and businesses save money — a clear win-win. But the sticky spot is designing bots that There are a few ways to avoid this. First, set expectations with customers. It’s a bad start when a bot says something as general as “Hi, what can I help you with today?”, as very few bots can help Instead, the bot should give hints as to what it If your platform supports it, the bot should quickly assess how likely it is that the user’s query can be resolved by an automated system. Bots are most helpful when it comes to common, simple queries that don’t require the bot to develop an understanding of complex issues. A good bot will proactively funnel complex, long-tail issues over to your human support team. If the bot can’t help, it should let the customer know early, and explicitly excuse itself. If customer support isn’t available, redirecting a customer to a help center is preferable to getting stuck going round-and-round with a bot that knows it can’t actually help you.Nothing leads to worse customer experience than someone feeling like they’re trapped in support jail. A well-designed bot will let customers exit at any time, even if there isn’t a human to talk to. Don’t be tempted to keep customers in the bot flow because you don’t have enough human support resources. Trapping the customer without a place to go, or building a navigation flow without a clear exit, is not good for the customer experience. Bad experiences lead to frustration, negative word-of-mouth, and an unwillingness to later engage with self-serve content that The best way to allow customers to exit the bot depends on context. The most obvious solution is to have an always-present button that lets the customer exit. But some less obvious features will work just as well. Consider designing your bot to say one thing and then stop unless spoken to again, or to bow out if a user ignores its prompts. This lets customers exit by default. You can also design your bot to recognize exit syntax — words like “exit” or “quit” or “go away” — that a customer may say. The end goal is to make it easy for a customer to leave the conversation if they need to — the responsibility lies with the business to facilitate this.Customer relationships are the cornerstone of business success, and you can’t build great customer relationships without great experiences and personal communication. The “personal” generally means communication that feels friendly, easy, and quick. From a technical standpoint, this means bots should have no artificial loading delays and no walls of text. Customers also shouldn’t have to hunt for answers through an endless tree or be encouraged to stay in a support interaction that can’t help them. If your bot has certain flows that some customers must follow to progress their request — for example, if the customer must answer questions about their company before talking to sales, or enter their product make and model before accessing technical support—these flows shouldn’t be triggered until they are needed. Don’t frontload them automatically to customers they aren’t relevant for. Similarly, if customers are sometimes required to grant privacy permissions, or authenticate, the bot should prompt for these only as needed.HOW CHATBOTS ARE MAKING BANKING MORE CONVERSATIONALThe impact of each individual delay is small, but taken together will add up to a support experience that feels either fast and respectful, or frustrating and uncaring. Customers will notice when this principle is followed: they’ve been jaded by waiting on hold while a voice tells them how much ‘their time is respected,’ so businesses that actually do follow this principle stand out.If you’re looking to design or use chatbots to improve your customer support, the best place to start is with customer-centric design principles. While technology is advancing rapidly, the foundations of good experiences will remain.This article was contributed by Fergal Reid (Ph.D.), Principal Machine Learning Engineer at ",How can we make chatbots that hit home with users?,https://techwireasia.com/2020/09/how-can-we-make-chatbots-that-hit-home-with-users/,1 September 2020
Automation,"Cities around the world are looking to leverage innovative technologies to improve the efficiency of local city services, create healthier urban environments, and to create more sustainable features i",https://cdn.techwireasia.com/wp-content/uploads/2020/07/Aerodyne-Celcom-partnership-897x500.jpg,"Cities around the world are looking to leverage innovative technologies to improve the efficiency of local city services, create healthier urban environments, and to create more sustainable features in areas including transportation, utilities, and public services.These smart city initiatives require collaboration between the private and public sectors in order to be effectively deployed, and to that end, Malaysian digital tech solutions provider Aerodyne Group has agreed a The aim of the partnership? To explore the development of drone technology.In a joint statement released last week, both entities affirmed their mutual dependence on telecommunications technology, but increasingly automation, artificial intelligence (AI), machine learning (ML) and 5G technology. The two groups will be looking to co-develop innovative solutions with potential applications for Aerodyne, which has been With the MoU signing, past Aerodyne applications will also be progressively powered by Celcom.Aerodyne and its working partners will also be able to participate in next-generation research and development in telecommunications technologies being headed up by Celcom’s Celcom has previously invested in Aerodyne, and the new MoU could see Celcom expanding its ecosystem of B2B solutions by adding Aerodyne drone tech as well. Idham Nawawi, the chief executive officer of Celcom Axiata Bhd, said that the company wants to work with a variety of technology partners, especially local startups, as the Malaysian telecom giant aims to become a leading IR4.0 technology adoption enabler.“The affiliation with local technology companies such as Aerodyne is a part of Celcom’s strategy towards stronger digital advocacy to aspiring local digital and technology entrepreneurs.” Nawawi said, adding that the initiative is a continuation to the support provided by Axiata Digital Fund (ADIF).“We hope to develop more similar collaborations to continuously inspire Malaysians technology entrepreneurs and startups into faster adoption of Internet of Things (IoT) and AI solutions, and at the same time contribute to the building of an inclusive local digital ecosystem.”Aerodyne’s AI-driven asset management and data-gathering tech could see immediate adoption in Similarly, the To maximize the efficiencies that the drone technology is capable of, a high speed connection that the likes of 5G can provide will be required. Aerodyne Group’s founder and group chief executive officer, Kamarul A Muhamed said: “We are excited about this strategic partnership with Celcom as our preferred connectivity provider to jointly explore and develop smart solutions using drones by leveraging on 5G technology.”“This will enable drones to transmit high definition footage in real-time,” he continued. “5G’s millisecond latency and data speeds of up to 100 times faster than 4G allows drones to transmit high-quality footage and data to operators on the ground.”",Celcom to co-develop 5G drone tech for smart cities and agritech,https://techwireasia.com/2020/07/celcom-to-co-develop-5g-drone-tech-for-smart-cities-and-agritech/,31 July 2020
Automation,"If bricks-and-mortar bank branches don’t close altogether within the next decade, they will undoubtedly offer an experience a world away from that of the last few decades. Stuffy queues at the cashier",https://cdn.techwireasia.com/wp-content/uploads/2020/08/shutterstock_1057848395-897x500.jpg,"If bricks-and-mortar bank branches don’t close altogether within the next decade, they will undoubtedly offer an experience a world away from that of the last few decades. Stuffy queues at the cashier counter will be replaced by a combination of self-service points and customer service assistants with iPads, ready to check-in and seat customers, even hand them a coffee, as they await an advisor to help them with a more complex transaction, such as opening an account or applying for a loan. The experience will be seamless and personal because most customers will be conducting their financial affairs from their smartphone. Digital banking is evolving at an incredible pace and, while customers will continue to crave the versatility offered by brick-and-mortar (From an app, customers today can check their accounts, transfer money and make payments, apply for loans or overdrafts, freeze their accounts, and cash in a check with their camera among plenty of other nifty features. But it is data, and what banks can do with it, which holds the real potential, from personalized spending plans and rewards to unnoticeable tweaks to user experience that make interactions seamless and intuitive, tailored to the individual user at the right time. Banks are leveraging customer data to dramatically enhance the customer experience and communications, once again making that personal touch and face-to-face advice possible, without stepping foot in-branch. This is conversational AI or chatbot technology, and it’s making our interactions with banks, from fintech challengers to incumbents, much more seamless. It’s enabling customers to ‘talk’ to banks about their accounts in a way that’s comfortable and intuitive, whenever they like. For banks themselves, it’s generating increased customer acquisition, conversions, and retention rates, all at a lower cost.AI is no new concept, of course, but its uptake in the banking industry has been accelerated by awareness of the need to enhance digital experiences and the availability ofLike any other business, banks are under pressure to move quickly with technology or lose out to more hungry and ambitious competitors and aggressive new kids on the block. With Gartner predicting that customers will manage 85% of their relationships with an enterprise without interacting with a human, and TechEmergence believing chatbots will become the primary consumer application within the next five years, conversational AI is now a series focus. And while digitization has been taking place in banking for decades, keeping pace with customers’ expectations for quick, convenient, secure services that can be accessed from anywhere on any device is no mean feat, especially as society barrels closer to a cashless future by the day. While established banks are shifting services online and investing heavily in front-end IT infrastructure, they are now vying for customers’ increasing expectations for “data-fueled, hyper-personalized experiences in real-time,” which incumbents in other sectors have been quicker to adapt to. Overall investment in new IT increased from 24% in 2016 to 33% in 2019, according to a report by Capgemini, but middle- and back-end operations are often still based on complex, manual business processes, leading to fragmented customer experiences.  The rise of conversational AI in banking has been fueled by a rise in conversational interfaces and natural language processing (NLP) technology that enables us to interact, transact, and collaborate using natural chat. Leveraging the behavior we are most used to using in social or mobile communications with our friends, family, and colleagues on channels like Whatsapp, Messenger, Teams or Slack, conversational AI programs break down the formality of communications with our banks, changing perceptions of them as a flexible, accessible, personable service built to serve us. It’s not just challenger banks like Monzo, Revolut, or Starling that are employing this conversational AI. Bank of America’sAs these communications channels continue to advance, customers can interact with banking processes, day and night, from enrolling new customers and walking through features, enabling the reporting potential fraud, applying for an increase on their credit card limit, or requesting a specific breakdown of spending on groceries, for example. The successful implementation of this technology has positive effects for the bank as a whole, which needs to invest less in customer service agents — while improving the attentivity of service among those remaining — with cost savings channeled into further innovation. The development in conversational AI would logically be further advances in the use of voice, negating the need for typing altogether. A customer’s app, in this sense, could become their own personal, financial advisor, able to answer any questions they have about their account or spending, drilling down into the data it has available. Mark Jones |As conversational AI or chatbot technology continues to advance, customers will see a shift away from mobile banking to conversational user interfaces (CUI). If they prefer, all interactions could be carried out by simply chatting (typing or speaking) to a CUI. Moving towards this conversational banking strategy will not be solely a technology endeavor — it will require the banking industry to continue to attract human talent with AI and NLP skills to keep pace with advancements of technology and ensure they’re integrated. At the same time, security must become",How chatbots are making banking more conversational,https://techwireasia.com/2020/08/how-chatbots-are-making-banking-more-conversational/,13 August 2020
