category,blurp,imgrul,text,title,url,date
Automation,"Rip Curl’s decision to migrate its data gathering and collection operations to the cloud earlier this year began to look like a wise move, during Australia’s pandemic lockdowns.The Australian surfwear",https://cdn.techwireasia.com/wp-content/uploads/2020/08/Rip-Curl-scaled-1-897x500.jpg,"Rip Curl’s decision to migrate its data gathering and collection operations to the cloud earlier this year began to look like a wise move, during Australia’s pandemic lockdowns.The Australian surfwear maker’s preeminent surfing competition, Rip Curl Pro, had to be postponed on short notice — like live public events globally. Internally, Rip Curl had already been consolidating data from disparate points along its operational chain — including from Rip Curl stores throughout the world — and had been working together with Microsoft to transition its data assets from on-premise platforms to Azure.Fortunately for the surfwear seller, a lot of its legacy data had already been extracted and transmitted to the cloud using Azure Data Factory to handle the migration. “We do have some tricky old 32-bit systems that don’t work within the Data Factory platform, but Microsoft always has a solution,” “So we’ve got a virtual machine that sits inside the architecture where we use some open-source Python scripts to connect to some of the more tricky infrastructure and do our ETL [extract, transform, load] that way.”After years of relying on spreadsheets and sales charts to Such visual toolsets add an entirely new element to pouring through, and understanding such vast quantities of data that might be collected by an international retail chain like Rip Curl. With the company now focused on setting its growth trajectory based on intelligent data insights, Rip Curl is presently integrating data points from its points of sale (POS) and from retail store counters – giving access to an in-depth range of data insights on When linked with Rip Curl’s e-commerce system and image database, Power BI can even visualize those data insights using images from Rip Curl’s inventory, rather than just looking at statistics on a spreadsheet. Power BI can also generate a delivery report so that store staff can see images of what is being delivered in each box and carton.“That’s great because we have a casual workforce and people have been with the business varying lengths of time. To come into the business, pick up that screen, see what’s expected in the box, and check it off, is something that I see a lot of demand for from the business,” said Connell.Connell stated that pilot projects are underway Connell saysLachlan Farran, the Group GM of Retail and Operations at Rip Curl, summed up the impact of that BI has had on his business: “BI has transformed the way we operate.  We now have a singular view of key customer drivers and understanding of product performance across a consistent real-time platform from in-store to head office.”",Rip Curl turns to intelligent data analytics to maintain its retail edge,https://techwireasia.com/2020/08/rip-curl-turns-to-intelligent-data-analytics-to-maintain-its-retail-edge/,17 August 2020
Automation,"Phishing attacks are a nuisance, but they’re also incredibly dangerous. They usually target our inbox, attempting to lure us into providing sensitive data, making payments, or handing over credentials",https://cdn.techwireasia.com/wp-content/uploads/2020/06/shutterstock_1172966818-897x500.jpg,"Phishing attacks are a nuisance, but they’re also incredibly dangerous. They usually target our inbox, attempting to lure us into providing sensitive data, making payments, or handing over credentials. They can the first step to a company’s demise.The most basic and easily-recognizable attempts follow a scenario where an individual, usually from somewhere distant enough not be contactable in person, has come into money, and needs someone (you) to help manage it for a chunk. In 2019, the average breach cost But that’s especially difficult when the red flags we’re told to look out for constantly change. A new scam targeting Wells Fargo customers demonstrates the evermore creative approaches cyberattackers are turning to. Some 15,000 customers of US multinational financial services giant Wells Fargo – which employs more than 260,000 employees across 7,400 locations globally – were targeted by a phishing campaign impersonating the Wells Fargo Security, luring victims into phishing pages with calendar invites. According to researchers at Abnormal Security, messages include .ics calendar file attachments containing events directing the recipients to phishing pages. The messages claimed customers must update their security keys using the instructions included in the calendar attachment, or have their accounts suspended. On a fake Wells Fargo page, users are prompted to enter sensitive information such as username, password, pin and account number. The scam is particularly clever as it encourages users to open the message on a smartphone, where the .ics file can automatically be added to their calendar. The victim subsequently receives a calendar event notification from their trusted app, which they are more likely to click. If the user falls for the scam and submits all their details, the attackers would have all the information they need to take control of targets’ accounts, steal their identity and money. Not a bad day’s work. Last year, scammers targeted Another clever scam from last year saw phishers using malicious customers 404 pages to serve phishing sites. 404 pages tell users when they’ve hit a broken or dead link. Targeting Microsoft, the attackers included links that pointed to non-existent pages, and when Microsoft security systems scanned the link, they’d receive the 404 error and deem the link safe. But if a real user accessed the same URL, the phishing site would detect the user and redirect them to an actual phishing page, instead of the server’s 404 error page. As phishing scams continue to change shape, they will more easily slip through the net: ",Wells Fargo phishing campaign shows threat continues to evolve,https://techwireasia.com/2020/06/wells-fargo-phishing-campaign-shows-threat-continues-to-evolve/,24 June 2020
Automation,"India is one of the countries most sorely affected by the coronavirus pandemic, with over 343,000 confirmed cases of infection and nearly 10,000 fatalities.The tallies put India as currently the fourt",https://cdn.techwireasia.com/wp-content/uploads/2020/06/shutterstock_720980785-897x500.jpg,"India is one of the countries most sorely affected by the coronavirus pandemic, with over 343,000 confirmed cases of infection and nearly 10,000 fatalities.The tallies put India as currently the fourth-worst nation in terms of impact, but there are signs of a recovery, with The Indian cities of Delhi and Mumbai now have among the highest recovery rates in the world with 38.36% and 46.65% recovery rates, respectively. This sort of statistical analysis has become commonplace in the Indian subcontinent in the past few months, and the Indian public who were used to receiving ‘Good Morning’ memes and forwarded messages in their WhatsApp chat groups (India has by far the biggest number of WhatsApp users in the world) now instead wake up to data infographics showing the latest updates surrounding the outbreak in their country.COVID-19 has changed the ways that Indians live their lives in various aspects, one of which is the newfound understanding and acceptance of data sets among the public. No longer just considered lines on a histogram, the average urban Indian has now become adept at following data-driven trends surrounding the pandemic, and terms such as ‘infection rates’, ‘mortality rates’, ‘flattening the curve’, and ‘exponential growth curve’ have all become standard terms in the lexicon of everyday conversation.In fact, much like other parts of the world, charts and data concepts have become the defacto method of imparting information related to the coronavirus and ongoing efforts to stem its deadly effects. For example, graphs showing COVID-19 infection rates, overlaid with the known healthcare capacity of an affected region, help the public to understand and grasp how social distancing and contact tracing measures can help limit outbreaks of new infections.The use of big data is by no means new in the country, with Data analytics does not require assembling resource-intensive, data-collection methods like surveys to gather information on the expansive region. Instead, data can work with artificial intelligence (AI) capabilities to run predictive models that can generate data digitally, and then be automatically compiled and analyzed in real-time – yielding faster, actionable data that organizations and businesses can use to inform other operational decision-making.Using agriculture as an example, big data could help study crop growth patterns, analyzing the best times to plant that would yield the highest crop production, study weather and seasonal patterns to determine best planting times, and so forth.The relevance of data, especially when paired with other technologies like AI, fast connectivity like 5G, and IoT-connected devices such as sensors to optimize data-gathering, has been With the critical functions that data analytics plays now plain to as a result of COVID-19 graphs and charts, both Indian organizations and civil services need to step up their utilization of valuable data resources at scale.As the country slowly begins to show signs of recovery, India should take note and perhaps prioritize ",How the pandemic made big data mainstream in India,https://techwireasia.com/2020/06/how-the-pandemic-made-big-data-mainstream-in-india/,17 June 2020
Automation,Like much of the corporate world that is The benefits of AI to the recruitment process is telling: artificial intelligence tech can help automate much of the repetitive and volume-intensive tasks in t,https://cdn.techwireasia.com/wp-content/uploads/2020/06/shutterstock_1279483576-897x500.jpg,"Like much of the corporate world that is The benefits of AI to the recruitment process is telling: artificial intelligence tech can help automate much of the repetitive and volume-intensive tasks in the process, while helping to filter and group applications and positions based on predetermined requirements of the recruiter.But while the time- and cost-saving advantages of AI are plentiful, questions still abound about the tech’s implementation in recruitment. Mainly, that more than one study has shown that These uncertainties give room for pause, especially for large, multinational organizations in Japan such as Softbank Corp, which hires over 1,000 individuals each year, and has trained its recruitment AI based on data from 1,500 past CVs.SoftBank’s director of recruitment, Tomoko Sugihara, told “Extra time that has been created thanks to AI allows recruiters more time to proactively engage with potential candidates in person, build relationships and carefully determine the candidates’ culture fit,” Sugihara said. “We of course cannot rely on AI for all the processes but making it learn our recruiting policies and standards for what kind of person we are looking for based on past data has helped us gain objectivity and uniformity in our hiring process.”AI-powered chatbots and video analysis software are also becoming recruitment techniques used by Japanese conglomerates in the initial stages of sorting, ranking, and shortlisting candidates. Data from past successful/unsuccessful applicants can be used to train AIs as to what a particular company is looking for from a new recruit.Tapping the power of AI for recruitment is A professor at Business Breakthrough University, Shinji Kawakami, says that Japanese companies are increasingly using AI to collect and analyze vast sums of candidate data that they receive during springtime – which is when Japanese tradition dictates that fresh graduates will be hired in droves, each business year.“[The companies] began to think it’s a waste not to use human resources data collected over the years,” Kawakami said. “They also want to make more accurate decisions in hiring as the interviewers’ decisions, influenced by his or her dislikes and likes, cannot always be trusted.”The data can also be used to standardize the pairing job requirements with particular candidate traits like experience and skillsets, which Kawakami says can lead to hiring the right, productive staff that will possess loyalty for the company – traits that are also highly sought after by Japanese firms.But observers believe that using AI to narrow down job applicants requires meticulous selection of comparison data to avoid discriminatory biases, many of which might be unintentionally picked up on by the AI. The selected data also needs to be regularly tested against the outcomes, to ensure the expected hiring objectives are being matched.“It is important that the system is monitored all the time and the model is reviewed continuously. Keeping and sharing a document which records information such as the intended use, training data and evaluation factors is useful,” says Toshihiro Kamishima, a senior researcher at the National Institute of Advanced Industrial Science and Technology. “The key is always to be able to fix the problem when it occurs.”",Japanese firms testing if AI in recruitment is the way to go,https://techwireasia.com/2020/06/japanese-firms-testing-if-ai-in-recruitment-is-the-way-to-go/,25 June 2020
Automation,"As organizations begin First there was a significant shift to work from home arrangements for a large segment of white-collar workers in the region, and now employees are easing back into on-premise w",https://cdn.techwireasia.com/wp-content/uploads/2020/06/000_1T5748-897x500.jpg,"As organizations begin First there was a significant shift to work from home arrangements for a large segment of white-collar workers in the region, and now employees are easing back into on-premise workplaces while observing many of the ‘new normal’ office setups such as spacing work stations apart by a meter or more.While employers strive to provide safe physical working zones free from infection, the threat of cyber infections in the workplace looms larger than ever in 2020. Prior to the global pandemic, a And that was before cybersecurity experts like “In Singapore, Ensign found that COVID-19-themed phishing attacks started in March 2020 and by April, the frequency of attacks surged by more than 100 times. Threat actors are looking to exploit people’s eagerness to get COVID-19 related advice and information by tricking them to click on malicious attachments and links in emails,” Lee Shih Yen, the senior vice president of Ensign Labs at Singapore-based cybersecurity experts Ensign InfoSecurity told The exponential explosion in COVID-related threat surfaces is “COVID-19 situation has compelled most organizations to roll out ad hoc systems and arrangements aimed at containing the virus spread while maintaining business continuity,” noted Ensign’s Lee. “However, as organizations’ priorities shift to focus on the rapid implementation and scaling of remote workforce initiatives as well as operational challenges introduced by safe distancing requirements, cybersecurity might be deprioritized. Vulnerabilities can surface as basic security, such as patching and updates, are delayed or neglected by overstrained IT teams.”The rapid shift towards remote working processes and now to even-more-recent ‘new normal’ work arrangements both in the office and outside, might have resulted in even more cybersecurity gaps that the beleaguered IT professionals will have to take note of. “As a result, the major changes in IT infrastructure and digital environment can potentially create new attack surfaces or broadening existing ones for threat actors to exploit, especially if organizations do not adopt a secure-by-design approach,” noted Lee.With a secure-by-design approach, cybersecurity experts say organizations can minimize systems vulnerabilities and reduce the attack surface through designing and building security in every phase of their digital systems’ design, development, and implementation. As organizations move to rapidly expand their remote working capabilities and infrastructure, they will be building it on a more secure digital foundation.Ensign InfoSecurity’s SVP Lee recommends that “cybersecurity teams should be involved at every step of the process or the organizations might risk spending a lot more time and resources remediating and recovering from security incidents that could have been mitigated or more easily addressed if proper cybersecurity measures are in place.”Thailand, Singapore, and Malaysia were identified as the most attractive targets for hackers in APAC, with companies in Singapore and Thailand likely to suffer the most financially as a result of a cyber-breach, the Cisco study found.And Ensign’s Singapore Threat Landscape report found that the high technology sector – including such digital companies like cloud, data center, and web hosting service providers – as the vertical most targeted in Singapore by threat actors in 2019. “The reason why threat actors are focused on high technology companies is to exploit their data center infrastructure and target the data of other organizations whose servers are being hosted there,” warned Lee.“The high technology sector plays a vital role in Singapore technology-driven economy and it will continue to be a critical engine for our economy in the post-COVID-19 world as remote working becomes the new normal, leading to an increase in cloud adoption and data center demands. It is likely that this sector will continue to be one of the prime targets for threat actors in the year ahead.”Lee suggests a proactive, combined approach to ",Cybersecurity experts on securing the ‘new normal’ APAC workplace,https://techwireasia.com/2020/06/cybersecurity-experts-on-securing-new-normal-apac-workplaces/,16 June 2020
Automation,"Southeast Asia is proving a natural ground for expansion by some of China’s biggest tech companies, but they’ll be locking horns with US counterparts who have a more established presence in the region",https://cdn.techwireasia.com/wp-content/uploads/2020/06/000_1RM1WZ-897x500.jpg,"Southeast Asia is proving a natural ground for expansion by some of China’s biggest tech companies, but they’ll be locking horns with US counterparts who have a more established presence in the region.The escalating political tensions between the world’s two largest economies has seen tech companies aiming to increase influence beyond their borders. Southeast Asia is now a booming hub for tech startups; 64 percent of the population is Chinese tech firms like These two firms join the likes of Huawei, which has opened a cloud and artificial intelligence (AI) innovation lab in the island state; AI start-up SenseTime; online travel platform Ctrip; social networking site YY, and telecoms provider China Telecom – all of which have increased their physical presence in Southeast Asia recently.According to property company JLL, outside of mainland China, Singapore is now home to the largest collection of Even in Singapore, which has political stability and a strong legal framework, Chinese companies had been playing catch up with American tech giants like Microsoft, Facebook, and Google which had been operating in the Southeast Asian region for a much longer time.While the political tensions with the US did play a part in Chinese firms expanding their reach in the region as they look to secure more of a global market, planting an office in Singapore helps these companies to grow their regional operations at a faster rate.Chinese venture capital firms have been increasing their investments in Southeast Asian startups, while Alibaba’s Jack Ma and Tencent Holdings had been making Regina Lim, head of capital markets research for JLL’s operations in Asia-Pacific, said that Chinese tech firms had been increasing their regional holdings here for at least five years now. “They feel like it is China 15 years ago and if they made so much money as Chinese internet penetration and e-commerce grew, so too can it happen in places like Indonesia and Thailand,” she said.For some firms, expansion is a way to grow business that’s otherwise stymied by the dominance of local rivals. With businesses in China largely ‘locked in’ to Alibaba, then, Tencent wants to take the fight to US rivals in markets outside of China, in markets where the battle between these two cloud blocs continues. ",China tech firms look to Southeast Asia as US rivalry intensifies,https://techwireasia.com/2020/06/china-tech-firms-look-to-southeast-asia-as-us-rivalry-intensifies/,2 June 2020
category,blurp,imgrul,text,title,url,date
Cloud,"While a brittle economy clouds enterprise spending plans in 2020, one thing is for certain, cybersecurity trumps most budgetary concerns for Asia Pacific (APAC) businesses.In fact, the 2020 CrowdStrik",https://cdn.techwireasia.com/wp-content/uploads/2020/07/shutterstock_1558664219-897x500.jpg,"While a brittle economy clouds enterprise spending plans in 2020, one thing is for certain, cybersecurity trumps most budgetary concerns for Asia Pacific (APAC) businesses.In fact, the 2020 CrowdStrike Asia Pacific and Japan (APJ) CrowdStrike’s latest study surveyed 2,017 business leaders in Australia, New Zealand, India, Singapore, Philippines, Thailand, Malaysia, Indonesia, Hong Kong and Japan, and found that the Prior to the global pandemic, a But the pandemic-led quarantine and its subsequent lockdown measures saw an Fortunately, a good many enterprise leaders in APAC are aware of the importance of readying their organizations and employees with cybersecurity education. However, 36% of respondents had not received any alerts or communications about While c-level execs must reassess their priorities (and budgets) as they ease into post-pandemic recovery, CrowdStrike’s report indicated that many APAC enterprises were experiencing an unprecedented wave of digital transformation, driven by the need to outlast uncertain economic prospects, including newly-distributed workforces and new supply chain channels.In fact, 44% of business leaders surveyed said the pandemic accelerated their move to cloud solutions, while 82% say COVID-19 changed the way they interact with or deliver products and services to customers. These results indicate a strong shift and rapid investment towards transformation projects that move from on-premise security solutions to next generation cloud-native solutions as organizations look to shore up new remote staff.Business leaders have changed their outlook on flexible working too; 67% of APAC business leaders believe that their organizations should invest more in building a remote work environment. Meanwhile, the top cybersecurity challenges expected in the next 18 months include a remote workforce (54%), new regulation (49%) and the cost of compliance (48%), with limited budgets (47%) and additional training (41%) ranking not far behind.“The COVID-19 pandemic may have had the biggest impact on the way organizations operate since the introduction of office PCs. The reaction of business leaders has been impressive, but the speed and size of change to a remote workforce led to some inevitable gaps, particularly in the cybersecurity of organizations,” “Our findings show that respondents understand these gaps and expect to address them in the recovery, going beyond ‘good enough’ security measures to ensure their employees remain secure against sophisticated threat activity regardless of where they are located. In the new business normal, it will be vital to implement solutions that can be quickly deployed at scale to detect new threats, adhere to new regulations and leverage the cloud so they can be easily managed remotely.”",Cybersecurity becomes top priority for APAC business leaders in 2020,https://techwireasia.com/2020/08/cybersecurity-becomes-top-priority-for-apac-business-leaders-in-2020/,3 August 2020
